{
  "style_name": "IEEE",
  "document": {
    "font": "Times New Roman",
    "font_size": 10,
    "line_spacing": 1.0,
    "alignment": "justify",
    "columns": 2,
    "margins": {
      "top": "0.75in",
      "bottom": "1in",
      "left": "0.625in",
      "right": "0.625in"
    }
  },
  "title_page": {
    "title_case": "Title Case",
    "title_bold": true,
    "title_centered": true,
    "title_font_size": 24
  },
  "abstract": {
    "label": "Abstract",
    "label_bold": true,
    "label_centered": false,
    "label_italic": false,
    "max_words": 250,
    "indent_first_line": false,
    "keywords_present": true,
    "keywords_label": "Index Terms—",
    "keywords_italic": false
  },
  "headings": {
    "H1": {
      "bold": false,
      "italic": false,
      "centered": true,
      "underline": false,
      "case": "UPPERCASE",
      "numbering": "roman",
      "font_size": 10
    },
    "H2": {
      "bold": true,
      "italic": false,
      "centered": false,
      "underline": false,
      "case": "Title Case",
      "numbering": "alpha",
      "font_size": 10
    },
    "H3": {
      "bold": false,
      "italic": true,
      "centered": false,
      "underline": false,
      "indent": true,
      "case": "Sentence case",
      "numbering": "numeric",
      "inline_with_text": true,
      "font_size": 10
    }
  },
  "citations": {
    "style": "numbered",
    "brackets": "square",
    "format_one_author": "[N]",
    "format_two_authors": "[N]",
    "format_three_plus": "[N]",
    "format_numbered": "[N]",
    "include_page_for_quotes": false,
    "page_format": "p. 45"
  },
  "references": {
    "section_label": "REFERENCES",
    "label_bold": false,
    "label_centered": true,
    "label_italic": false,
    "ordering": "appearance",
    "hanging_indent": true,
    "indent_size": "0.25in",
    "line_spacing": 1.0,
    "space_between_entries": false,
    "formats": {
      "journal_article": "[N] A. B. Author and C. D. Author, \"Title of article,\" Abbrev. Journal Name, vol. X, no. Y, pp. Z1–Z2, Month Year, doi: 10.1109/xxxxx.",
      "conference_paper": "[N] A. B. Author, \"Title of paper,\" in Proc. Conference Name, City, Country, Year, pp. X–Y.",
      "book": "[N] A. B. Author, Title of Book, Xth ed. City, Country: Publisher, Year.",
      "book_chapter": "[N] A. B. Author, \"Title of chapter,\" in Title of Book, Xth ed., A. Editor, Ed. City, Country: Publisher, Year, pp. X–Y.",
      "website": "[N] A. B. Author. (Year, Month Day). Title. [Online]. Available: URL"
    }
  },
  "figures": {
    "label_prefix": "Fig.",
    "label_bold": false,
    "label_italic": false,
    "caption_position": "below",
    "caption_alignment": "center",
    "caption_italic": false,
    "numbering": "arabic",
    "note_label": "Note."
  },
  "tables": {
    "label_prefix": "TABLE",
    "label_bold": true,
    "label_italic": false,
    "caption_position": "above",
    "caption_alignment": "center",
    "caption_italic": false,
    "numbering": "roman",
    "border_style": "full_grid",
    "note_label": "Note."
  },
  "equations": {
    "numbering": "right_aligned",
    "numbering_format": "(1)"
  },
  "general_rules": {
    "doi_format": "doi: 10.1109/xxxxx",
    "url_format": "Available: URL",
    "date_format": "Month Year",
    "et_al_threshold": 6,
    "use_ampersand_in_citations": false,
    "use_ampersand_in_references": false,
    "oxford_comma": false
  }
}